{
  "artifact_count": 141,
  "artifacts": [
    {
      "bytes": 1252,
      "category": "support",
      "path": ".github/ISSUE_TEMPLATE/benchmark_case.yml",
      "sha256": "3e05e84b607097a826ad4790157eb0382932355825f8fd4fa5388147ce707077"
    },
    {
      "bytes": 30,
      "category": "support",
      "path": ".github/ISSUE_TEMPLATE/config.yml",
      "sha256": "408ee312d9fa0f969866944296fecc640300e93a9a16d7aadaf24fb58948bc5b"
    },
    {
      "bytes": 2568,
      "category": "support",
      "path": ".github/ISSUE_TEMPLATE/leaderboard_submission.yml",
      "sha256": "e19574192589ec891226e2f6d097e6c63fe76c548a2f2d6c67e9d053e07ea10e"
    },
    {
      "bytes": 1551,
      "category": "support",
      "path": ".github/ISSUE_TEMPLATE/standard_change.yml",
      "sha256": "f2b8c8a9b60b9e9913247aaca013e7034265d5b1d0c2d5751a1fb2179f07cd22"
    },
    {
      "bytes": 2110,
      "category": "support",
      "path": ".github/ISSUE_TEMPLATE/third_party_evidence.yml",
      "sha256": "d8fc06ff4b91810a9071a06bee6cf50a08162828d487987f4e9a07f8f3e8b97c"
    },
    {
      "bytes": 969,
      "category": "support",
      "path": ".github/PULL_REQUEST_TEMPLATE.md",
      "sha256": "f4f9c671310bcba0466ea6ff68dbf4801634cc5564dc419b3508c3d96b7af4ab"
    },
    {
      "bytes": 548,
      "category": "support",
      "path": ".github/workflows/benchmark-ci.yml",
      "sha256": "d24c3f2742b11f46cb7e2676a0cb1d18e961339647aa4264f7c754c4f4d28b57"
    },
    {
      "bytes": 581,
      "category": "root",
      "path": "CITATION.cff",
      "sha256": "354b019e5ed28bb15d374f7bf672f5838158e69a1edc27724020ef3f334e30f1"
    },
    {
      "bytes": 1839,
      "category": "root",
      "path": "CONTRIBUTING.md",
      "sha256": "691199753f651e78e1d9f05989c4c85541d2ea7cac21c02f88970e66a20704cd"
    },
    {
      "bytes": 2350,
      "category": "root",
      "path": "LICENSE",
      "sha256": "fe70234e152ad5faadd9d3e8dad33988186edba5ac618f3ce2b69be893fdf205"
    },
    {
      "bytes": 15336,
      "category": "root",
      "path": "README.md",
      "sha256": "898ad804908cb99c23b2fc436d5786eabc24976fdd26905f83f4b2939aab0d28"
    },
    {
      "bytes": 2150,
      "category": "support",
      "path": "adoption/README.md",
      "sha256": "b78c1a86742e12a721a8dcf62d5b0a852c713d4d1771e05f65c8c264307dca57"
    },
    {
      "bytes": 1600,
      "category": "support",
      "path": "adoption/implementation_kit/README.md",
      "sha256": "9e4811f8b33e15545f8ba5bdc33957e47e8f1c3f1c835214d3236f0a6253737c"
    },
    {
      "bytes": 694,
      "category": "support",
      "path": "adoption/implementation_kit/github_actions_validate_result.yml",
      "sha256": "4a3a98497602c257e7d4237f401e69c49692d321869b0b368ee1c6639ee9709a"
    },
    {
      "bytes": 619,
      "category": "support",
      "path": "adoption/implementation_kit/result_claim_badge.md",
      "sha256": "56d7f9ec6d9a34f436063ce1cd0b5792ac51ac27096714a5fb7ea59ea4588006"
    },
    {
      "bytes": 15803,
      "category": "adoption",
      "path": "adoption/marked_bench_adoption_packet_v0_4_8.json",
      "sha256": "8b7f0ee14b59e892f534f334eb2bc769d22e4c4b53fc4ba7ecf31cdcdfe50c5f"
    },
    {
      "bytes": 5941,
      "category": "adoption",
      "path": "adoption/marked_bench_implementation_kit_v0_4_8.json",
      "sha256": "9e85d1d227feee8d1e52e244899027966589bb71cd7ed7cf6de35bf5200bd96d"
    },
    {
      "bytes": 972,
      "category": "adoption",
      "path": "adoption/third_party_evidence_ledger_v0_4_8.json",
      "sha256": "26e640ed9e9b9e0d062a602208f4b4ea0dca999e738be5dd007564eac88b9fa3"
    },
    {
      "bytes": 1194,
      "category": "support",
      "path": "baselines/README.md",
      "sha256": "b97d29ecf8c7278687270f73a1db3b649364a4cfca9c76d06b655cfd90fbc7d2"
    },
    {
      "bytes": 40813,
      "category": "track:contradiction-adversarial:baseline",
      "path": "baselines/always_none_adversarial_v0_2_0.json",
      "sha256": "c965975dba10ba54b4546cdecd3b41665b9f1a8b230a1ea8b1884d1d95a62960"
    },
    {
      "bytes": 35616,
      "category": "track:contradiction-controls:baseline",
      "path": "baselines/always_none_controls_v0_4_0.json",
      "sha256": "5f727dfcf51900bb6fd48235efcb04014b5bf83e71fb7cd19b65c9b04e3a3f27"
    },
    {
      "bytes": 42546,
      "category": "track:contradiction-multihop:baseline",
      "path": "baselines/always_none_multihop_v0_3_0.json",
      "sha256": "3f93efeccfd9641d9fad6353eba3182ae9b3cf80aa52f7a00e83865365b00560"
    },
    {
      "bytes": 36290,
      "category": "track:contradiction:baseline",
      "path": "baselines/always_none_v0_1_0.json",
      "sha256": "1556817246fdcd8468896fac2d9109566cc10322d1553e6cd4b27f0be56d37ee"
    },
    {
      "bytes": 39452,
      "category": "track:contradiction-adversarial:baseline",
      "path": "baselines/contradiction_engine_adversarial_v0_2_0.json",
      "sha256": "6c37a8ca3ee43252dfafeb053b09433bab36afeaa051c80795fb7a95012a9d73"
    },
    {
      "bytes": 33756,
      "category": "track:contradiction-controls:baseline",
      "path": "baselines/contradiction_engine_controls_v0_4_0.json",
      "sha256": "c05c2dc461ab329ce9d5375c0d32ccfc67d28d70cb5ec6938e437de1df6035ba"
    },
    {
      "bytes": 42189,
      "category": "track:contradiction-multihop:baseline",
      "path": "baselines/contradiction_engine_multihop_v0_3_0.json",
      "sha256": "99e042d3d4b0690bd793722c245cbfceb4c26811147b6661a3293c7e6f98395a"
    },
    {
      "bytes": 32549,
      "category": "track:contradiction:baseline",
      "path": "baselines/contradiction_engine_v0_1_0.json",
      "sha256": "63892e8732090bdd27ac95cb63882e10f59b47bed3c03aed4a43d4b488c7b834"
    },
    {
      "bytes": 24504,
      "category": "root",
      "path": "benchmark_registry.json",
      "sha256": "ed71832d2fa320bc6623fd3cae143374b642c5a6b7511224744c62d48138cec2"
    },
    {
      "bytes": 847,
      "category": "support",
      "path": "conformance/README.md",
      "sha256": "a3fc5ebe51cee553b4cf0c62ab9555c1b0c5d160490e278e2a2e6a2f313cecf3"
    },
    {
      "bytes": 3651,
      "category": "conformance",
      "path": "conformance/marked_bench_conformance_v0_4_8.json",
      "sha256": "156c953af37d0f6e290d36403542011f63cd20058cc3a56e7e3c4fcd8e9fee67"
    },
    {
      "bytes": 7082,
      "category": "governance",
      "path": "docs/ADOPTION_GUIDE.md",
      "sha256": "c1bb9c785b4cc6197684c5bd88bb5aa1fe985da41ac040053655abbed93a13f9"
    },
    {
      "bytes": 7607,
      "category": "governance",
      "path": "docs/ANNOUNCEMENT_PACKAGE.md",
      "sha256": "52def0cbabb817879b9cc804b872bd4eb256f5a126ae7f4a9ac7d008cbe5983b"
    },
    {
      "bytes": 5213,
      "category": "governance",
      "path": "docs/BENCHMARK_CARD.md",
      "sha256": "457e9cdd5f340e79c05efeacb5dd71bdba63947c7abc9d56352eae53ea3657d2"
    },
    {
      "bytes": 16875,
      "category": "governance",
      "path": "docs/BENCHMARK_STANDARD.md",
      "sha256": "d9db5258764e5b95ec5c76483f1b7107d9a6148d03af5dc4c102b7235adc9d31"
    },
    {
      "bytes": 1914,
      "category": "support",
      "path": "docs/CHANGE_CONTROL.md",
      "sha256": "56fe53e7b77f9f124964fb13fb16c621bbd407e10a71e94530b9e83f5e2d3427"
    },
    {
      "bytes": 3285,
      "category": "governance",
      "path": "docs/GOVERNANCE.md",
      "sha256": "ffc3d097abba71e5036dea3db1874b5861145c099c015c855eb2571b81c45537"
    },
    {
      "bytes": 5584,
      "category": "governance",
      "path": "docs/RELEASE_CHECKLIST.md",
      "sha256": "b94c9b04c26039811fb60a613c1b7936e4a3bd54ccc0080154639df6e41e0911"
    },
    {
      "bytes": 1596,
      "category": "governance",
      "path": "docs/RELEASE_NOTES_v0_2_0.md",
      "sha256": "ee60d8112f840794fef0f6c73bcf64a1b7f04bb71a7083ade7d0d266b9fc3aa2"
    },
    {
      "bytes": 2317,
      "category": "governance",
      "path": "docs/RELEASE_NOTES_v0_3_0.md",
      "sha256": "0478851975227d0fe0e33404490082deed9142c8d722a2d36bcdcf46136cbedb"
    },
    {
      "bytes": 1407,
      "category": "governance",
      "path": "docs/RELEASE_NOTES_v0_3_1.md",
      "sha256": "89766854b39a9c90f42986e797d4677a93cf4ca4acc90005edb992424a8ed935"
    },
    {
      "bytes": 1157,
      "category": "governance",
      "path": "docs/RELEASE_NOTES_v0_3_10.md",
      "sha256": "220f38a703c8272e5a6e9ccdbe73ac6cb6a533e1cc479f44dfce15858d811e12"
    },
    {
      "bytes": 1154,
      "category": "governance",
      "path": "docs/RELEASE_NOTES_v0_3_2.md",
      "sha256": "f46eefc40376a9dad2fe6835caf7cf1b908f0c1262a27ee9159a44f733b12351"
    },
    {
      "bytes": 1271,
      "category": "governance",
      "path": "docs/RELEASE_NOTES_v0_3_3.md",
      "sha256": "d6e8b9fd7e55e79e7f716b941badf4fede681ca6248587c9b5b30f55df292e5f"
    },
    {
      "bytes": 1051,
      "category": "governance",
      "path": "docs/RELEASE_NOTES_v0_3_4.md",
      "sha256": "d1b5b128ebb016eaf1bfd3fd180694f848c6c16ef66a005a9b244750c1389d6e"
    },
    {
      "bytes": 1058,
      "category": "governance",
      "path": "docs/RELEASE_NOTES_v0_3_5.md",
      "sha256": "d618c4b6d16608f10eb63cd0fa48293abafb4e3afefa276e3ec48a36e7cce50f"
    },
    {
      "bytes": 1200,
      "category": "governance",
      "path": "docs/RELEASE_NOTES_v0_3_6.md",
      "sha256": "236cfc4c63d126d67a49e8784a7b028f5ced54ac370f6e0e6e1ebf6451da1693"
    },
    {
      "bytes": 1345,
      "category": "governance",
      "path": "docs/RELEASE_NOTES_v0_3_7.md",
      "sha256": "cf93bf5ffae0c3e5f877aa3abd0f79b5f9bf6653065eeb0a4e774e7a2bbf3e69"
    },
    {
      "bytes": 1366,
      "category": "governance",
      "path": "docs/RELEASE_NOTES_v0_3_8.md",
      "sha256": "1e531b610151129d1d1d99822df4878b6133910cb46f83d04959d53c3a121185"
    },
    {
      "bytes": 1224,
      "category": "governance",
      "path": "docs/RELEASE_NOTES_v0_3_9.md",
      "sha256": "d9e40c73336cc077281752ccebe3c0b38c1b4880daa57556c15209f5b610cdd0"
    },
    {
      "bytes": 1511,